{
  "schemaVersion": 1,
  "campaignId": "first10-04bfd3a61ca7-53f556f1",
  "candidateId": "g0-prerequisite-first",
  "parentCandidate": null,
  "generation": 0,
  "baselineCommit": "04bfd3a61ca743c4476945984bb8f9ecd0be99e5",
  "candidateCommit": "0aebaabc5f11e4e125c0f146726090b43c11aec0",
  "riskRing": 3,
  "constitution": {
    "version": "once-evolution-constitution/1",
    "hash": "26f1d7fe1397081cc500ad43657331b9fb8c4e0c9620afda11913e67f6075692"
  },
  "evaluator": {
    "version": "trusted-kernel/1",
    "hash": "4faa0929b03733f3110b217dbaf756dcc951428b85ac79e758fe6f576acfc1d0"
  },
  "roles": {
    "proposer": "trusted bounded-data interpreter/1",
    "builder": "trusted fixed edit operators/1",
    "breaker": "independent protected safety/mutation suite/1",
    "coldUser": "structural synthetic observer/1",
    "legitimizer": "kernel admission/1"
  },
  "target": "FIRST10 documentation",
  "hypothesis": "Prerequisite order violation becomes zero without adding proof commands.",
  "filesChanged": [
    "docs/first10/index.html"
  ],
  "diffStatistics": {
    "bytes": 2066,
    "sha256": "0dfab3725b63875532a9ddc96f1b6ab8db3cebc779f6d488958fb09152f5ae1e"
  },
  "results": {
    "ordinary": {
      "passed": true,
      "command": [
        "node",
        "--test",
        "sdk/typescript/test/first10.test.mjs",
        "sdk/typescript/test/local.test.mjs",
        "sdk/typescript/test/wrap-tool.test.mjs",
        "sdk/typescript/test/local-session.test.mjs",
        "scripts/website-funnel.test.mjs"
      ],
      "log": "ordinary.log",
      "sha256": "c82074a414801be396d1e44a6e38aec74ff368c301a286382c383a34917c4db2"
    },
    "property": {
      "passed": true,
      "tests": [
        {
          "id": "intent-b5b64b23d2527f65",
          "scenario": "replay",
          "passed": true,
          "entered": true,
          "writes": 2,
          "journal": "C:\\Users\\jamie\\Documents\\Codex\\2026-10-04\\files-pasted-by-the-user-you\\work\\evolution-campaign-5\\evaluation\\property\\state\\case-0\\provider.jsonl",
          "observedStates": [
            "CONFIRMED"
          ],
          "observedCounts": [
            1,
            1,
            1,
            2,
            2
          ]
        },
        {
          "id": "intent-b3715b79c5c59a54",
          "scenario": "conflict",
          "passed": true,
          "entered": true,
          "writes": 2,
          "journal": "C:\\Users\\jamie\\Documents\\Codex\\2026-10-04\\files-pasted-by-the-user-you\\work\\evolution-campaign-5\\evaluation\\property\\state\\case-1\\provider.jsonl",
          "observedStates": [
            "CONFIRMED"
          ],
          "observedCounts": [
            1,
            1,
            1,
            2,
            2
          ]
        },
        {
          "id": "intent-5ca1d238b175bb91",
          "scenario": "unknown",
          "passed": true,
          "entered": true,
          "writes": 1,
          "journal": "C:\\Users\\jamie\\Documents\\Codex\\2026-10-04\\files-pasted-by-the-user-you\\work\\evolution-campaign-5\\evaluation\\property\\state\\case-2\\provider.jsonl",
          "observedStates": [
            "UNKNOWN",
            "UNKNOWN",
            "UNKNOWN",
            "UNKNOWN",
            "UNKNOWN",
            "CONFIRMED"
          ],
          "observedCounts": [
            1,
            1,
            1,
            1,
            1
          ]
        },
        {
          "id": "intent-2779140df7cd5658",
          "scenario": "absent",
          "passed": true,
          "entered": true,
          "writes": 1,
          "journal": "C:\\Users\\jamie\\Documents\\Codex\\2026-10-04\\files-pasted-by-the-user-you\\work\\evolution-campaign-5\\evaluation\\property\\state\\case-3\\provider.jsonl",
          "observedStates": [
            "UNKNOWN",
            "UNKNOWN",
            "CONFIRMED"
          ],
          "observedCounts": [
            1,
            1,
            1,
            1,
            1
          ]
        },
        {
          "id": "intent-e588c4012554dd04",
          "scenario": "unavailable",
          "passed": true,
          "entered": true,
          "writes": 1,
          "journal": "C:\\Users\\jamie\\Documents\\Codex\\2026-10-04\\files-pasted-by-the-user-you\\work\\evolution-campaign-5\\evaluation\\property\\state\\case-4\\provider.jsonl",
          "observedStates": [
            "UNKNOWN",
            "UNKNOWN",
            "UNKNOWN",
            "CONFIRMED"
          ],
          "observedCounts": [
            1,
            1,
            1,
            1
          ]
        },
        {
          "id": "intent-3152eb2013d4951c",
          "scenario": "missing-result",
          "passed": true,
          "entered": true,
          "writes": 1,
          "journal": "C:\\Users\\jamie\\Documents\\Codex\\2026-10-04\\files-pasted-by-the-user-you\\work\\evolution-campaign-5\\evaluation\\property\\state\\case-5\\provider.jsonl",
          "observedStates": [
            "UNKNOWN",
            "UNKNOWN",
            "CONFIRMED"
          ],
          "observedCounts": [
            1,
            1,
            1,
            1
          ]
        },
        {
          "id": "intent-e8d4e70b92987cad",
          "scenario": "corrupt-receipt",
          "passed": true,
          "entered": true,
          "writes": 2,
          "journal": "C:\\Users\\jamie\\Documents\\Codex\\2026-10-04\\files-pasted-by-the-user-you\\work\\evolution-campaign-5\\evaluation\\property\\state\\case-6\\provider.jsonl",
          "observedStates": [
            "CONFIRMED"
          ],
          "observedCounts": [
            1,
            1,
            1,
            1,
            2,
            2
          ]
        },
        {
          "id": "intent-dca4ea7d90bb3bf6",
          "scenario": "concurrency",
          "passed": true,
          "entered": true,
          "writes": 2,
          "journal": "C:\\Users\\jamie\\Documents\\Codex\\2026-10-04\\files-pasted-by-the-user-you\\work\\evolution-campaign-5\\evaluation\\property\\state\\case-7\\provider.jsonl",
          "observedStates": [
            "CONFIRMED"
          ],
          "observedCounts": [
            1,
            2,
            2
          ]
        },
        {
          "id": "intent-8fc33adb28ae8c94",
          "scenario": "restart",
          "passed": true,
          "entered": true,
          "writes": 1,
          "journal": "C:\\Users\\jamie\\Documents\\Codex\\2026-10-04\\files-pasted-by-the-user-you\\work\\evolution-campaign-5\\evaluation\\property\\state\\case-8\\provider.jsonl",
          "observedStates": [
            "UNKNOWN",
            "CONFIRMED"
          ],
          "observedCounts": [
            1,
            1,
            1,
            1,
            1
          ]
        },
        {
          "id": "intent-ec4840731aff63c1",
          "scenario": "attempt",
          "passed": true,
          "entered": true,
          "writes": 2,
          "journal": "C:\\Users\\jamie\\Documents\\Codex\\2026-10-04\\files-pasted-by-the-user-you\\work\\evolution-campaign-5\\evaluation\\property\\state\\case-9\\provider.jsonl",
          "observedStates": [
            "CONFIRMED"
          ],
          "observedCounts": [
            1,
            1,
            1,
            1,
            1,
            2,
            2
          ]
        },
        {
          "id": "intent-17dae2dc6e34eec3",
          "scenario": "omit-field",
          "passed": true,
          "entered": true,
          "writes": 2,
          "journal": "C:\\Users\\jamie\\Documents\\Codex\\2026-10-04\\files-pasted-by-the-user-you\\work\\evolution-campaign-5\\evaluation\\property\\state\\case-10\\provider.jsonl",
          "observedStates": [
            "CONFIRMED"
          ],
          "observedCounts": [
            1,
            1,
            1,
            2,
            2
          ]
        }
      ],
      "violations": [],
      "counts": {
        "0:intent-b5b64b23d2527f65": {
          "entered": true,
          "writes": 2,
          "journal": "C:\\Users\\jamie\\Documents\\Codex\\2026-10-04\\files-pasted-by-the-user-you\\work\\evolution-campaign-5\\evaluation\\property\\state\\case-0\\provider.jsonl",
          "observedStates": [
            "CONFIRMED"
          ],
          "observedCounts": [
            1,
            1,
            1,
            2,
            2
          ]
        },
        "1:intent-b3715b79c5c59a54": {
          "entered": true,
          "writes": 2,
          "journal": "C:\\Users\\jamie\\Documents\\Codex\\2026-10-04\\files-pasted-by-the-user-you\\work\\evolution-campaign-5\\evaluation\\property\\state\\case-1\\provider.jsonl",
          "observedStates": [
            "CONFIRMED"
          ],
          "observedCounts": [
            1,
            1,
            1,
            2,
            2
          ]
        },
        "2:intent-5ca1d238b175bb91": {
          "entered": true,
          "writes": 1,
          "journal": "C:\\Users\\jamie\\Documents\\Codex\\2026-10-04\\files-pasted-by-the-user-you\\work\\evolution-campaign-5\\evaluation\\property\\state\\case-2\\provider.jsonl",
          "observedStates": [
            "UNKNOWN",
            "UNKNOWN",
            "UNKNOWN",
            "UNKNOWN",
            "UNKNOWN",
            "CONFIRMED"
          ],
          "observedCounts": [
            1,
            1,
            1,
            1,
            1
          ]
        },
        "3:intent-2779140df7cd5658": {
          "entered": true,
          "writes": 1,
          "journal": "C:\\Users\\jamie\\Documents\\Codex\\2026-10-04\\files-pasted-by-the-user-you\\work\\evolution-campaign-5\\evaluation\\property\\state\\case-3\\provider.jsonl",
          "observedStates": [
            "UNKNOWN",
            "UNKNOWN",
            "CONFIRMED"
          ],
          "observedCounts": [
            1,
            1,
            1,
            1,
            1